{
  "$schema": "http://json-schema.org/draft-07/schema#",
  "$id": "https://proto.local/td/level.schema.json",
  "title": "Proto TD Level",
  "description": "TD level JSON. Primary source of truth per HR-TD-4. Output of stage-pcg-wfc is one valid instance.",
  "type": "object",
  "required": ["schemaVersion", "levelId", "gridSize", "cellSize", "seed", "tiles", "paths", "powerSources", "coreBase", "linkBudget"],
  "additionalProperties": false,
  "properties": {
    "schemaVersion": {
      "description": "Schema version. Bump on breaking changes (HR-TD-4).",
      "type": "integer",
      "const": 1
    },
    "levelId": {
      "description": "Stable level identifier. Used in asset path Assets/Proto/Data/TD/Levels/<levelId>.json (HR-TD-10).",
      "type": "string",
      "pattern": "^[a-z0-9][a-z0-9-_]*$"
    },
    "gridSize": {
      "description": "Grid width and height in cells. Q7 defaults: 20 / 40 / 80.",
      "type": "object",
      "required": ["w", "h"],
      "additionalProperties": false,
      "properties": {
        "w": { "type": "integer", "minimum": 1, "maximum": 512 },
        "h": { "type": "integer", "minimum": 1, "maximum": 512 }
      }
    },
    "cellSize": {
      "description": "World units per cell. Fixed at 1m for Proto.",
      "type": "number",
      "exclusiveMinimum": 0
    },
    "seed": {
      "description": "Xorshift64 seed used for generation. Hex string with 0x prefix (HR-TD-2).",
      "type": "string",
      "pattern": "^0x[0-9a-fA-F]{1,16}$"
    },
    "tiles": {
      "description": "2D tile grid. tiles[y][x] = tileId. Length MUST be gridSize.h, each row length MUST be gridSize.w.",
      "type": "array",
      "items": {
        "type": "array",
        "items": { "type": "string" }
      }
    },
    "paths": {
      "description": "Enemy paths (Q6 lanes). Each path is a polyline of grid-cell waypoints from spawn edge to coreBase.",
      "type": "array",
      "minItems": 1,
      "items": {
        "type": "array",
        "minItems": 2,
        "items": {
          "type": "object",
          "required": ["x", "y"],
          "additionalProperties": false,
          "properties": {
            "x": { "type": "integer", "minimum": 0 },
            "y": { "type": "integer", "minimum": 0 }
          }
        }
      }
    },
    "powerSources": {
      "description": "Power source cell positions. At least 1 required.",
      "type": "array",
      "minItems": 1,
      "items": {
        "type": "object",
        "required": ["x", "y"],
        "additionalProperties": false,
        "properties": {
          "x": { "type": "integer", "minimum": 0 },
          "y": { "type": "integer", "minimum": 0 }
        }
      }
    },
    "coreBase": {
      "description": "Core base cell position. All enemy paths must terminate here.",
      "type": "object",
      "required": ["x", "y"],
      "additionalProperties": false,
      "properties": {
        "x": { "type": "integer", "minimum": 0 },
        "y": { "type": "integer", "minimum": 0 }
      }
    },
    "linkBudget": {
      "description": "Total link-distance budget for placing hubs (HR-TD-6).",
      "type": "number",
      "exclusiveMinimum": 0
    },
    "meta": {
      "description": "Optional generator metadata for reproducibility and debugging. Not required for gameplay.",
      "type": "object",
      "additionalProperties": false,
      "properties": {
        "generator": { "type": "string" },
        "generatorVersion": { "type": "string" },
        "tileSetId": { "type": "string" },
        "iterations": { "type": "integer", "minimum": 0 },
        "createdAt": { "type": "string", "format": "date-time" }
      }
    }
  }
}
