{
  "schemaVersion": 1,
  "levelId": "level-wfc-40-c0ffee",
  "gridSize": {
    "w": 40,
    "h": 40
  },
  "cellSize": 1,
  "seed": "0xc0ffee",
  "tiles": [
    [
      "border-void",
      "border-void",
      "border-void",
      "border-void",
      "border-void",
      "border-void",
      "border-void",
      "border-void",
      "border-void",
      "border-void",
      "border-void",
      "border-void",
      "border-void",
      "border-void",
      "border-void",
      "border-void",
      "border-void",
      "border-void",
      "border-void",
      "border-void",
      "border-void",
      "border-void",
      "border-void",
      "border-void",
      "border-void",
      "border-void",
      "border-void",
      "border-void",
      "border-void",
      "border-void",
      "border-void",
      "border-void",
      "border-void",
      "border-void",
      "border-void",
      "border-void",
      "border-void",
      "border-void",
      "border-void",
      "border-void"
    ],
    [
      "border-void",
      "road-corner-ne",
      "road-straight-ew",
      "road-straight-ew",
      "road-straight-ew",
      "road-straight-ew",
      "road-straight-ew",
      "road-straight-ew",
      "road-t-n@r2",
      "road-t-n@r2",
      "road-straight-ew",
      "road-straight-ew",
      "road-straight-ew",
      "road-straight-ew",
      "road-straight-ew",
      "road-straight-ew",
      "road-t-n@r2",
      "road-straight-ew",
      "road-straight-ew",
      "road-straight-ew",
      "road-straight-ew",
      "road-straight-ew",
      "road-straight-ew",
      "road-straight-ew",
      "road-t-n@r2",
      "road-straight-ew",
      "road-straight-ew",
      "road-straight-ew",
      "road-straight-ew",
      "road-t-n@r2",
      "road-t-n@r2",
      "road-straight-ew",
      "road-straight-ew",
      "road-straight-ew",
      "road-straight-ew",
      "road-straight-ew",
      "road-straight-ew",
      "road-straight-ew",
      "road-corner-ne@r3",
      "border-void"
    ],
    [
      "border-void",
      "road-straight-ns",
      "grass-flat",
      "grass-flat",
      "grass-flat",
      "grass-flat",
      "grass-flat",
      "grass-flat",
      "road-t-n@r3",
      "road-t-n@r1",
      "grass-flat",
      "grass-flat",
      "grass-flat",
      "grass-flat",
      "grass-flat",
      "grass-flat",
      "road-straight-ns",
      "grass-flat",
      "grass-flat",
      "grass-flat",
      "grass-flat",
      "grass-flat",
      "grass-flat",
      "grass-flat",
      "road-straight-ns",
      "grass-flat",
      "grass-flat",
      "grass-flat",
      "grass-flat",
      "road-t-n@r3",
      "road-t-n@r1",
      "grass-flat",
      "grass-flat",
      "grass-flat",
      "grass-flat",
      "grass-flat",
      "grass-flat",
      "grass-flat",
      "road-straight-ns",
      "border-void"
    ],
    [
      "border-void",
      "road-straight-ns",
      "grass-flat",
      "building-small",
      "building-small",
      "building-small",
      "grass-flat",
      "grass-flat",
      "road-t-n@r3",
      "road-t-n@r1",
      "grass-flat",
      "building-small",
      "building-small",
      "building-small",
      "grass-flat",
      "grass-flat",
      "road-straight-ns",
      "grass-flat",
      "building-small",
      "building-small",
      "building-small",
      "building-small",
      "grass-flat",
      "grass-flat",
      "road-straight-ns",
      "grass-flat",
      "grass-bush",
      "grass-bush",
      "grass-flat",
      "road-t-n@r3",
      "road-t-n@r1",
      "grass-flat",
      "grass-bush",
      "grass-bush",
      "grass-bush",
      "grass-bush",
      "grass-bush",
      "grass-flat",
      "road-straight-ns",
      "border-void"
    ],
    [
      "border-void",
      "road-straight-ns",
      "grass-flat",
      "building-small",
      "building-small",
      "building-small",
      "grass-flat",
      "grass-flat",
      "road-t-n@r3",
      "road-t-n@r1",
      "grass-flat",
      "building-small",
      "building-small",
      "building-small",
      "grass-flat",
      "grass-flat",
      "road-straight-ns",
      "grass-flat",
      "building-small",
      "building-small",
      "building-small",
      "building-small",
      "grass-flat",
      "grass-flat",
      "road-straight-ns",
      "grass-flat",
      "grass-bush",
      "grass-bush",
      "grass-flat",
      "road-t-n@r3",
      "road-t-n@r1",
      "grass-flat",
      "grass-bush",
      "grass-bush",
      "grass-bush",
      "grass-bush",
      "grass-bush",
      "grass-flat",
      "road-straight-ns",
      "border-void"
    ],
    [
      "border-void",
      "road-straight-ns",
      "grass-flat",
      "building-small",
      "building-small",
      "power-pad",
      "grass-flat",
      "grass-flat",
      "road-t-n@r3",
      "road-t-n@r1",
      "grass-flat",
      "building-small",
      "building-small",
      "building-small",
      "grass-flat",
      "grass-flat",
      "road-straight-ns",
      "grass-flat",
      "building-small",
      "building-small",
      "building-small",
      "building-small",
      "grass-flat",
      "grass-flat",
      "road-straight-ns",
      "grass-flat",
      "grass-bush",
      "grass-bush",
      "grass-flat",
      "road-t-n@r3",
      "road-t-n@r1",
      "grass-flat",
      "grass-bush",
      "grass-bush",
      "grass-bush",
      "grass-bush",
      "grass-bush",
      "grass-flat",
      "road-straight-ns",
      "border-void"
    ],
    [
      "border-void",
      "road-straight-ns",
      "grass-flat",
      "grass-flat",
      "grass-flat",
      "grass-flat",
      "grass-flat",
      "grass-flat",
      "road-t-n@r3",
      "road-t-n@r1",
      "grass-flat",
      "grass-flat",
      "grass-flat",
      "grass-flat",
      "grass-flat",
      "grass-flat",
      "road-straight-ns",
      "grass-flat",
      "grass-flat",
      "grass-flat",
      "grass-flat",
      "grass-flat",
      "grass-flat",
      "grass-flat",
      "road-straight-ns",
      "grass-flat",
      "grass-bush",
      "grass-bush",
      "grass-flat",
      "road-t-n@r3",
      "road-t-n@r1",
      "grass-flat",
      "grass-bush",
      "grass-bush",
      "grass-bush",
      "grass-bush",
      "grass-bush",
      "grass-flat",
      "road-straight-ns",
      "border-void"
    ],
    [
      "border-void",
      "road-straight-ns",
      "grass-flat",
      "grass-flat",
      "grass-flat",
      "grass-flat",
      "grass-flat",
      "grass-flat",
      "road-t-n@r3",
      "road-t-n@r1",
      "grass-flat",
      "grass-flat",
      "grass-flat",
      "grass-flat",
      "grass-flat",
      "grass-flat",
      "road-straight-ns",
      "grass-flat",
      "grass-flat",
      "grass-flat",
      "grass-flat",
      "grass-flat",
      "grass-flat",
      "grass-flat",
      "road-straight-ns",
      "grass-flat",
      "grass-flat",
      "grass-flat",
      "grass-flat",
      "road-t-n@r3",
      "road-t-n@r1",
      "grass-flat",
      "grass-flat",
      "grass-flat",
      "grass-flat",
      "grass-flat",
      "grass-flat",
      "grass-flat",
      "road-straight-ns",
      "border-void"
    ],
    [
      "border-void",
      "road-t-n@r3",
      "road-t-n@r2",
      "road-t-n@r2",
      "road-t-n@r2",
      "road-t-n@r2",
      "road-t-n@r2",
      "road-t-n@r2",
      "road-cross",
      "road-cross",
      "road-t-n@r2",
      "road-t-n@r2",
      "road-t-n@r2",
      "road-t-n@r2",
      "road-t-n@r2",
      "road-t-n@r2",
      "road-cross",
      "road-t-n@r2",
      "road-t-n@r2",
      "road-t-n@r2",
      "road-t-n@r2",
      "road-t-n@r2",
      "road-t-n@r2",
      "road-t-n@r2",
      "road-cross",
      "road-t-n@r2",
      "road-t-n@r2",
      "road-t-n@r2",
      "road-t-n@r2",
      "road-cross",
      "road-cross",
      "road-t-n@r2",
      "road-t-n@r2",
      "road-t-n@r2",
      "road-t-n@r2",
      "road-t-n@r2",
      "road-t-n@r2",
      "road-t-n@r2",
      "road-t-n@r1",
      "border-void"
    ],
    [
      "border-void",
      "road-t-n@r3",
      "road-t-n",
      "road-t-n",
      "road-t-n",
      "road-t-n",
      "road-t-n",
      "road-t-n",
      "road-cross",
      "road-cross",
      "road-t-n",
      "road-t-n",
      "road-t-n",
      "road-t-n",
      "road-t-n",
      "road-t-n",
      "road-cross",
      "road-t-n",
      "road-t-n",
      "road-t-n",
      "road-t-n",
      "road-t-n",
      "road-t-n",
      "road-t-n",
      "road-cross",
      "road-t-n",
      "road-t-n",
      "road-t-n",
      "road-t-n",
      "road-cross",
      "road-cross",
      "road-t-n",
      "road-t-n",
      "road-t-n",
      "road-t-n",
      "road-t-n",
      "road-t-n",
      "road-t-n",
      "road-t-n@r1",
      "border-void"
    ],
    [
      "border-void",
      "road-straight-ns",
      "grass-flat",
      "grass-flat",
      "grass-flat",
      "grass-flat",
      "grass-flat",
      "grass-flat",
      "road-t-n@r3",
      "road-t-n@r1",
      "grass-flat",
      "grass-flat",
      "grass-flat",
      "grass-flat",
      "grass-flat",
      "grass-flat",
      "road-straight-ns",
      "grass-flat",
      "grass-flat",
      "grass-flat",
      "grass-flat",
      "grass-flat",
      "grass-flat",
      "grass-flat",
      "road-straight-ns",
      "grass-flat",
      "grass-flat",
      "grass-flat",
      "grass-flat",
      "road-t-n@r3",
      "road-t-n@r1",
      "grass-flat",
      "grass-flat",
      "grass-flat",
      "grass-flat",
      "grass-flat",
      "grass-flat",
      "grass-flat",
      "road-straight-ns",
      "border-void"
    ],
    [
      "border-void",
      "road-straight-ns",
      "grass-flat",
      "building-small",
      "building-small",
      "building-small",
      "grass-flat",
      "grass-flat",
      "road-t-n@r3",
      "road-t-n@r1",
      "grass-flat",
      "building-small",
      "building-small",
      "building-small",
      "grass-flat",
      "grass-flat",